{
  "schema": "embedaiassist.chip.registers.v1",
  "mcu_family": "FT61F14X",
  "source": {
    "svd": null,
    "sdk_header": null,
    "reference_manual": null,
    "extracted_at": "2026-09-20T11:58:47"
  },
  "registers": [
    {
      "peripheral": "RSTC",
      "name": "LVDCON0",
      "address": "0x199",
      "offset": null,
      "access": "rw",
      "description": "章节 4.8.4",
      "bitfields": [
        {
          "name": "LVDL",
          "bits": "0:2",
          "access": "rw",
          "reset_value": "0",
          "description": "低电压侦测选择位值 检测电压000保留001010 2.0V011 2.4V100 2.8V101 3.0V110 3.（bit 2:0）"
        },
        {
          "name": "LVDW",
          "bits": "3",
          "access": "r",
          "reset_value": "0",
          "description": "低电压标志位，只读当LVDP=0时：1：VDD掉到了LVDL[2:0]所设置的电压0：VDD高于LVDL[2:0]所设置（bit 3）"
        },
        {
          "name": "LVDEN",
          "bits": "4",
          "access": "rw",
          "reset_value": "0",
          "description": "低电压侦测使能1：开启LVD侦测功能0：关闭LVD侦测功能（bit 4）"
        },
        {
          "name": "LVDM",
          "bits": "5:6",
          "access": "rw",
          "reset_value": "0",
          "description": "LVD模块检测电压源选择1 = 检测外部管脚PC0（这时如果LVDEN为1，PC0变为模拟管脚）0 = 检测内部电压（bit 6）"
        },
        {
          "name": "SLVREN",
          "bits": "7",
          "access": "rw",
          "reset_value": "0",
          "description": "软件控制LVR使能位，当UCFG1<1:0>为01时：1 = 打开LVR0 = 禁止LVR当UCFG1<1:0>不为01（bit 7）"
        }
      ]
    },
    {
      "peripheral": "RSTC",
      "name": "LVDCON1",
      "address": "0xF8E",
      "offset": null,
      "access": "",
      "description": "章节 4.8.5",
      "bitfields": [
        {
          "name": "LVDCAL",
          "bits": "3:",
          "access": "",
          "reset_value": "1",
          "description": ""
        }
      ]
    },
    {
      "peripheral": "RSTC",
      "name": "LVDTUNE",
      "address": "0xF92",
      "offset": null,
      "access": "",
      "description": "章节 4.8.6",
      "bitfields": [
        {
          "name": "LVDCAL",
          "bits": "3:",
          "access": "",
          "reset_value": "1",
          "description": ""
        }
      ]
    },
    {
      "peripheral": "RSTC",
      "name": "PCON",
      "address": "0x96",
      "offset": null,
      "access": "",
      "description": "章节 4.10.1",
      "bitfields": [
        {
          "name": "/BORF",
          "bits": "0",
          "access": "",
          "reset_value": "1",
          "description": "低电压复位标志，低有效0：发生了低电压复位1：没发生低电压复位或者由软件置1/BOR在上电复位后其值不确定，必须由软件置（bit 0）"
        },
        {
          "name": "/PORF",
          "bits": "1",
          "access": "",
          "reset_value": "0",
          "description": "上电复位标志，低有效0：发生了上电复位1：没发生上电复位或者由软件置1PORF在上电复位后值为0，此后软件应该将其置1（bit 1）"
        },
        {
          "name": "/SRSTF",
          "bits": "2",
          "access": "",
          "reset_value": "1",
          "description": "软件复位标志，低有效0：执行了RESET指令1：未执行RESET指令，或由软件置1（bit 2）"
        },
        {
          "name": "/MCLRR",
          "bits": "3",
          "access": "",
          "reset_value": "1",
          "description": "外部复位标志，低有效0：发生了MCLR复位1：未发生MCLR复位或由软件置1（bit 3）"
        },
        {
          "name": "IERRR",
          "bits": "4",
          "access": "",
          "reset_value": "0",
          "description": "非法指令复位标志，高有效0：未发生非法指令复位或由软件清01：发生了非法指令复位复位（bit 4）"
        },
        {
          "name": "EMCF",
          "bits": "5",
          "access": "",
          "reset_value": "0",
          "description": "EMC复位标志，高有效0：未发生EMC复位或由软件清01：发生了EMC复位复位（bit 5）"
        },
        {
          "name": "STKUNF",
          "bits": "6",
          "access": "",
          "reset_value": "0",
          "description": "堆栈下溢标志位，高有效0：未发生堆栈下溢，或该位由软件清01：发生了堆栈下溢（bit 6）"
        },
        {
          "name": "STKOVF",
          "bits": "7",
          "access": "",
          "reset_value": "0",
          "description": "堆栈上溢标志位，高有效0：未发生堆栈上溢，或该位由软件清01：发生了堆栈上溢（bit 7）"
        }
      ]
    },
    {
      "peripheral": "OSC",
      "name": "CKAUX",
      "address": "0xF8D",
      "offset": null,
      "access": "rw",
      "description": "章节 5.6.1",
      "bitfields": [
        {
          "name": "CLKOS",
          "bits": "0:1",
          "access": "rw",
          "reset_value": "1",
          "description": "时钟输出选择0：时钟从PA7口输出1：时钟从PB1口输出（bit 1）"
        }
      ]
    },
    {
      "peripheral": "OSC",
      "name": "OSCCON",
      "address": "0x99",
      "offset": null,
      "access": "rw",
      "description": "章节 5.6.2",
      "bitfields": [
        {
          "name": "TUN",
          "bits": "0:7",
          "access": "rw",
          "reset_value": "8’bxxxx_xxxx",
          "description": ""
        }
      ]
    },
    {
      "peripheral": "OSC",
      "name": "OSCTUNE",
      "address": "0x98",
      "offset": null,
      "access": "rw",
      "description": "章节 5.6.3",
      "bitfields": [
        {
          "name": "TUN",
          "bits": "0:7",
          "access": "rw",
          "reset_value": "8’bxxxx_xxxx",
          "description": ""
        }
      ]
    },
    {
      "peripheral": "OSC",
      "name": "PCKEN",
      "address": "0x9A",
      "offset": null,
      "access": "rw",
      "description": "章节 5.6.4",
      "bitfields": [
        {
          "name": "ADCEN",
          "bits": "0",
          "access": "rw",
          "reset_value": "0",
          "description": ""
        },
        {
          "name": "TIM1EN",
          "bits": "1",
          "access": "rw",
          "reset_value": "0",
          "description": ""
        },
        {
          "name": "TIM2EN",
          "bits": "2",
          "access": "rw",
          "reset_value": "0",
          "description": ""
        },
        {
          "name": "TIM4EN",
          "bits": "3",
          "access": "rw",
          "reset_value": "0",
          "description": ""
        },
        {
          "name": "UARTEN",
          "bits": "4:5",
          "access": "rw",
          "reset_value": "0",
          "description": ""
        }
      ]
    },
    {
      "peripheral": "OSC",
      "name": "CKOCON",
      "address": "0x95",
      "offset": null,
      "access": "rw",
      "description": "章节 5.6.5",
      "bitfields": [
        {
          "name": "CCOEN",
          "bits": "0",
          "access": "rw",
          "reset_value": "0",
          "description": "时钟输出使能位：1 = 使能时钟输出0 = 禁止时钟输出（bit 0）"
        },
        {
          "name": "CCOSEL",
          "bits": "1:3",
          "access": "rw",
          "reset_value": "0",
          "description": ""
        },
        {
          "name": "DTYSEL",
          "bits": "4:5",
          "access": "rw",
          "reset_value": "1",
          "description": "TIM1/TIM2倍频时钟占空比调节位00：2ns 延迟01：3ns 延迟10：4ns 延迟(default)11：7n（bit 5:4）"
        },
        {
          "name": "CCORDY",
          "bits": "6",
          "access": "r",
          "reset_value": "0",
          "description": "时钟输出标志位，只读1 = 时钟正在输出0 = 时钟未输出（bit 6）"
        },
        {
          "name": "SYSON",
          "bits": "7",
          "access": "rw",
          "reset_value": "0",
          "description": "睡眠状态下的系统时钟控制位1 = 睡眠状态下，系统时钟保持运行0 = 睡眠状态下，系统时钟关闭（bit 7）"
        }
      ]
    },
    {
      "peripheral": "OSC",
      "name": "TCKSRC",
      "address": "0x31F",
      "offset": null,
      "access": "rw",
      "description": "章节 5.6.6",
      "bitfields": [
        {
          "name": "T1CKSRC",
          "bits": "0:2",
          "access": "rw",
          "reset_value": "0",
          "description": "TIM1时钟源选择位值 时钟源0 系统时钟/主时钟1 HIRC2 XT时钟/外部时钟3 HIRC的2倍频4 XT时钟/外（bit 2:0）"
        },
        {
          "name": "T2CKSRC",
          "bits": "3:6",
          "access": "rw",
          "reset_value": "0",
          "description": "TIM2时钟源选择位值 时钟源0 系统时钟/主时钟1 HIRC2 XT时钟/外部时钟3 HIRC的2倍频4 XT时钟/外（bit 6:4）"
        },
        {
          "name": "LFMOD",
          "bits": "7",
          "access": "rw",
          "reset_value": "0",
          "description": "低频内振模式：1 = 256k 振荡频率模式0 = 32k 振荡频率模式（bit 7）"
        }
      ]
    },
    {
      "peripheral": "INTC",
      "name": "INTCON",
      "address": "0x0B",
      "offset": null,
      "access": "rw",
      "description": "章节 6.5.1",
      "bitfields": [
        {
          "name": "OSFIF",
          "bits": "0",
          "access": "rw",
          "reset_value": "0",
          "description": "1 = 发生了时钟缺失事件（写1清0，写0无效）0 = 未发生时钟缺失事件，或已由软件清0（bit 0）"
        },
        {
          "name": "LVDIF",
          "bits": "1",
          "access": "rw",
          "reset_value": "0",
          "description": "LVD中断标志位（写1清0，写0无效）1 = 发生欠压事件0 = 未发生欠压事件，或已由软件清0（bit 1）"
        },
        {
          "name": "EEIF",
          "bits": "2",
          "access": "rw",
          "reset_value": "0",
          "description": "EEPROM写完成标志位（写1清0，写0无效）1 = EEPROM完成写操作0 = EEPROM写操作未完成，或已由软件（bit 2）"
        },
        {
          "name": "OSFIE",
          "bits": "3",
          "access": "rw",
          "reset_value": "0",
          "description": "时钟缺失中断使能1 = 使能OSF的中断0 = 禁止OSF的中断（bit 3）"
        },
        {
          "name": "LVDIE",
          "bits": "4",
          "access": "rw",
          "reset_value": "0",
          "description": "LVD中断使能1 = 使能LVD的中断0 = 禁止LVD的中断（bit 4）"
        },
        {
          "name": "EEIE",
          "bits": "5",
          "access": "rw",
          "reset_value": "0",
          "description": "EEPROM写完成中断使能1 = 使能EEPROM的中断0 = 禁止EEPROM的中断（bit 5）"
        },
        {
          "name": "PEIE",
          "bits": "6",
          "access": "rw",
          "reset_value": "0",
          "description": "外设中断使能1 = 使能所有未屏蔽的外设中断0 = 禁止所有的外设中断（bit 6）"
        },
        {
          "name": "GIE",
          "bits": "7",
          "access": "rw",
          "reset_value": "0",
          "description": "全局中断使能1 = 使能所有未屏蔽中断0 = 禁止所有中断（bit 7）"
        }
      ]
    },
    {
      "peripheral": "INTC",
      "name": "PIR1",